ProductID,ProductName,ProductPrice,SupplierPrice,Category,SubCategory
OFF-AR-10001662,Rogers Handheld Barrel Pencil Sharpener,274.0,200.0,Office Supplies,Art
OFF-AR-10001683,Lumber Crayons,985.0,611.0,Office Supplies,Art
OFF-AR-10001725,Boston Home & Office Model 2000 Electric Pencil Sharpeners,2365.0,1750.0,Office Supplies,Art
OFF-AR-10001761,Avery Hi-Liter Smear-Safe Highlighters,584.0,374.0,Office Supplies,Art
OFF-AR-10001770,Economy #2 Pencils,266.0,197.0,Office Supplies,Art
OFF-AR-10001860,BIC Liqua Brite Liner,694.0,444.0,Office Supplies,Art
OFF-AR-10001868,Prang Dustless Chalk Sticks,168.0,84.0,Office Supplies,Art
OFF-AR-10001897,Model L Table or Wall-Mount Pencil Sharpener,1798.0,1295.0,Office Supplies,Art
OFF-AR-10001915,Peel-Off China Markers,993.0,576.0,Office Supplies,Art
OFF-AR-10001919,"OIC #2 Pencils, Medium Soft",188.0,133.0,Office Supplies,Art
OFF-AR-10001940,"Sanford Colorific Eraseable Coloring Pencils, 12 Count",328.0,187.0,Office Supplies,Art
OFF-AR-10001953,Boston 1645 Deluxe Heavier-Duty Electric Pencil Sharpener,4398.0,3211.0,Office Supplies,Art
OFF-AR-10001954,Newell 331,488.0,357.0,Office Supplies,Art
OFF-AR-10001955,Newell 319,1984.0,1389.0,Office Supplies,Art
OFF-AR-10001958,Stanley Bostitch Contemporary Electric Pencil Sharpeners,1698.0,1223.0,Office Supplies,Art
OFF-AR-10001972,Newell 323,168.0,124.0,Office Supplies,Art
OFF-AR-10001988,Bulldog Table or Wall-Mount Pencil Sharpener,599.0,425.0,Office Supplies,Art
OFF-AR-10002053,"Premium Writing Pencils, Soft, #2 by Central Association for the Blind",298.0,215.0,Office Supplies,Art
OFF-AR-10002067,Newell 334,1984.0,1468.0,Office Supplies,Art
OFF-AR-10002135,Boston Heavy-Duty Trimline Electric Pencil Sharpeners,4820.0,3422.0,Office Supplies,Art
OFF-AR-10002221,12 Colored Short Pencils,260.0,190.0,Office Supplies,Art
OFF-AR-10002240,Panasonic KP-150 Electric Pencil Sharpener,3774.0,2793.0,Office Supplies,Art
OFF-AR-10002255,Newell 346,288.0,204.0,Office Supplies,Art
OFF-AR-10002257,"Eldon Spacemaker Box, Quick-Snap Lid, Clear",334.0,229.0,Office Supplies,Art
OFF-AR-10002280,Staples in misc. colors,647.0,356.0,Office Supplies,Art
OFF-AR-10002335,DIXON Oriole Pencils,258.0,191.0,Office Supplies,Art
OFF-AR-10002375,Newell 351,328.0,233.0,Office Supplies,Art
OFF-AR-10002399,"Dixon Prang Watercolor Pencils, 10-Color Set with Brush",426.0,250.0,Office Supplies,Art
OFF-AR-10002445,SANFORD Major Accent Highlighters,708.0,438.0,Office Supplies,Art
OFF-AR-10002467,Dixon Ticonderoga Pencils,298.0,218.0,Office Supplies,Art
OFF-AR-10002578,Newell 335,288.0,204.0,Office Supplies,Art
OFF-AR-10002656,Sanford Liquid Accent Highlighters,668.0,421.0,Office Supplies,Art
OFF-AR-10002671,"Hunt BOSTON Model 1606 High-Volume Electric Pencil Sharpener, Beige",17391.0,12522.0,Office Supplies,Art
OFF-AR-10002704,Boston 1900 Electric Pencil Sharpener,1498.0,1049.0,Office Supplies,Art
OFF-AR-10002766,Prang Drawing Pencil Set,278.0,202.0,Office Supplies,Art
OFF-AR-10002804,Faber Castell Col-Erase Pencils,488.0,289.0,Office Supplies,Art
OFF-AR-10002818,Panasonic KP-310 Heavy-Duty Electric Pencil Sharpener,2198.0,1539.0,Office Supplies,Art
OFF-AR-10002833,Newell 322,182.0,133.0,Office Supplies,Art
OFF-AR-10002952,Stanley Contemporary Battery Pencil Sharpeners,1335.0,961.0,Office Supplies,Art
OFF-AR-10002956,Boston 16801 Nautilus Battery Pencil Sharpener,2201.0,1629.0,Office Supplies,Art
OFF-AR-10002987,Prismacolor Color Pencil Set,1984.0,1171.0,Office Supplies,Art
OFF-AR-10003045,Prang Colored Pencils,294.0,162.0,Office Supplies,Art
OFF-AR-10003056,Newell 341,428.0,304.0,Office Supplies,Art
OFF-AR-10003087,Staples in misc. colors,178.0,128.0,Office Supplies,Art
OFF-AR-10003156,50 Colored Long Pencils,1016.0,752.0,Office Supplies,Art
OFF-AR-10003158,Fluorescent Highlighters by Dixon,398.0,263.0,Office Supplies,Art
OFF-AR-10003179,Dixon Ticonderoga Core-Lock Colored Pencils,911.0,610.0,Office Supplies,Art
OFF-AR-10003183,Avery Fluorescent Highlighter Four-Color Set,334.0,234.0,Office Supplies,Art
OFF-AR-10003190,Newell 32,288.0,206.0,Office Supplies,Art
OFF-AR-10003217,Newell 316,488.0,352.0,Office Supplies,Art
OFF-AR-10003251,Prang Drawing Pencil Set,278.0,167.0,Office Supplies,Art
OFF-AR-10003338,"Eberhard Faber 3 1/2"" Golf Pencils",744.0,558.0,Office Supplies,Art
OFF-AR-10003373,"Boston School Pro Electric Pencil Sharpener, 1670",3098.0,2262.0,Office Supplies,Art
OFF-AR-10003394,Newell 332,294.0,215.0,Office Supplies,Art
OFF-AR-10003405,"Dixon My First Ticonderoga Pencil, #2",585.0,415.0,Office Supplies,Art
OFF-AR-10003469,Nontoxic Chalk,176.0,92.0,Office Supplies,Art
OFF-AR-10003477,4009 Highlighters,134.0,88.0,Office Supplies,Art
OFF-AR-10003478,"Avery Hi-Liter EverBold Pen Style Fluorescent Highlighters, 4/Pack",814.0,488.0,Office Supplies,Art
OFF-AR-10003481,Newell 348,328.0,233.0,Office Supplies,Art
OFF-AR-10003504,Newell 347,428.0,304.0,Office Supplies,Art
OFF-AR-10003514,4009 Highlighters by Sanford,398.0,267.0,Office Supplies,Art
OFF-AR-10003560,Zebra Zazzle Fluorescent Highlighters,608.0,401.0,Office Supplies,Art
OFF-AR-10003582,"Boston Electric Pencil Sharpener, Model 1818, Charcoal Black",2815.0,2027.0,Office Supplies,Art
OFF-AR-10003602,"Quartet Omega Colored Chalk, 12/Pack",584.0,310.0,Office Supplies,Art
OFF-AR-10003631,Staples in misc. colors,484.0,324.0,Office Supplies,Art
OFF-AR-10003651,Newell 350,328.0,233.0,Office Supplies,Art
OFF-AR-10003696,Panasonic KP-350BK Electric Pencil Sharpener with Auto Stop,3458.0,2455.0,Office Supplies,Art
OFF-AR-10003723,Avery Hi-Liter Fluorescent Desk Style Markers,338.0,213.0,Office Supplies,Art
OFF-AR-10003727,Berol Giant Pencil Sharpener,1698.0,1206.0,Office Supplies,Art
OFF-AR-10003732,Newell 333,278.0,206.0,Office Supplies,Art
OFF-AR-10003752,Deluxe Chalkboard Eraser Cleaner,1155.0,624.0,Office Supplies,Art
OFF-AR-10003759,"Crayola Anti Dust Chalk, 12/Pack",182.0,100.0,Office Supplies,Art
OFF-AR-10003770,Newell 340,288.0,204.0,Office Supplies,Art
OFF-AR-10003772,Boston 16750 Black Compact Battery Pencil Sharpener,875.0,612.0,Office Supplies,Art
OFF-AR-10003811,Newell 327,221.0,161.0,Office Supplies,Art
OFF-AR-10003829,Newell 35,328.0,233.0,Office Supplies,Art
OFF-AR-10003856,Newell 344,278.0,206.0,Office Supplies,Art
OFF-AR-10003876,"Avery Hi-Liter GlideStik Fluorescent Highlighter, Yellow Ink",326.0,183.0,Office Supplies,Art
OFF-AR-10003896,"Stride Job 150 Highlighters, Chisel Tip, Assorted Colors",598.0,383.0,Office Supplies,Art
OFF-AR-10003903,Sanford 52201 APSCO Electric Pencil Sharpener,4097.0,3032.0,Office Supplies,Art
OFF-AR-10003958,Newell 337,328.0,233.0,Office Supplies,Art
OFF-AR-10003986,Avery Hi-Liter Pen Style Six-Color Fluorescent Set,385.0,227.0,Office Supplies,Art
OFF-AR-10004010,Hunt Boston Vacuum Mount KS Pencil Sharpener,3499.0,2589.0,Office Supplies,Art
OFF-AR-10004022,Panasonic KP-380BK Classic Electric Pencil Sharpener,3597.0,2698.0,Office Supplies,Art
OFF-AR-10004027,"Binney & Smith inkTank Erasable Desk Highlighter, Chisel Tip, Yellow, 12/Box",252.0,149.0,Office Supplies,Art
OFF-AR-10004042,"BOSTON Model 1800 Electric Pencil Sharpeners, Putty/Woodgrain",1798.0,1277.0,Office Supplies,Art
OFF-AR-10004062,Staples in misc. colors,1048.0,786.0,Office Supplies,Art
OFF-AR-10004078,Newell 312,584.0,409.0,Office Supplies,Art
OFF-AR-10004165,"Binney & Smith inkTank Erasable Pocket Highlighter, Chisel Tip, Yellow",227.0,128.0,Office Supplies,Art
OFF-AR-10004260,Boston 1799 Powerhouse Electric Pencil Sharpener,2598.0,1871.0,Office Supplies,Art
OFF-AR-10004269,Newell 31,413.0,297.0,Office Supplies,Art
OFF-AR-10004272,Newell 308,168.0,126.0,Office Supplies,Art
OFF-AR-10004344,Bulldog Vacuum Base Pencil Sharpener,1199.0,875.0,Office Supplies,Art
OFF-AR-10004441,BIC Brite Liner Highlighters,413.0,240.0,Office Supplies,Art
OFF-AR-10004456,Panasonic KP-4ABK Battery-Operated Pencil Sharpener,1464.0,1039.0,Office Supplies,Art
OFF-AR-10004511,"Sanford Colorific Scented Colored Pencils, 12/Pack",428.0,295.0,Office Supplies,Art
OFF-AR-10004582,BIC Brite Liner Grip Highlighters,164.0,90.0,Office Supplies,Art
OFF-AR-10004587,"Boston 1827 Commercial Additional Cutter, Drive Gear & Gear Rack for 1606",1982.0,1388.0,Office Supplies,Art
OFF-AR-10004602,Boston KS Multi-Size Manual Pencil Sharpener,2299.0,1655.0,Office Supplies,Art
OFF-AR-10004648,Boston 19500 Mighty Mite Electric Pencil Sharpener,2014.0,1471.0,Office Supplies,Art
OFF-AR-10004685,"Binney & Smith Crayola Metallic Colored Pencils, 8-Color Set",463.0,310.0,Office Supplies,Art
OFF-AR-10004691,Boston 1730 StandUp Electric Pencil Sharpener,2138.0,1582.0,Office Supplies,Art
OFF-AR-10004707,Staples in misc. colors,248.0,161.0,Office Supplies,Art
OFF-AR-10004752,Blackstonian Pencils,267.0,192.0,Office Supplies,Art
OFF-AR-10004757,Crayola Colored Pencils,328.0,220.0,Office Supplies,Art
OFF-AR-10004790,Staples in misc. colors,1197.0,898.0,Office Supplies,Art
OFF-AR-10004817,Colorific Watercolor Pencils,516.0,366.0,Office Supplies,Art
OFF-AR-10004930,Turquoise Lead Holder with Pocket Clip,670.0,449.0,Office Supplies,Art
OFF-AR-10004956,Newell 33,558.0,396.0,Office Supplies,Art
OFF-AR-10004974,Newell 342,328.0,233.0,Office Supplies,Art
OFF-AR-10004999,Newell 315,598.0,449.0,Office Supplies,Art
OFF-BI-10000014,Heavy-Duty E-Z-D Binders,1091.0,578.0,Office Supplies,Binders
OFF-BI-10000042,"Pressboard Data Binder, Crimson, 12"" X 8 1/2""",534.0,288.0,Office Supplies,Binders
OFF-BI-10000050,"Angle-D Binders with Locking Rings, Label Holders",730.0,387.0,Office Supplies,Binders
OFF-BI-10000069,"GBC Prepunched Paper, 19-Hole, for Binding Systems, 24-lb",1501.0,811.0,Office Supplies,Binders
OFF-BI-10000088,GBC Imprintable Covers,1098.0,560.0,Office Supplies,Binders
OFF-BI-10000136,Avery Non-Stick Heavy Duty View Round Locking Ring Binders,598.0,311.0,Office Supplies,Binders
OFF-BI-10000138,Acco Translucent Poly Ring Binders,468.0,243.0,Office Supplies,Binders
OFF-BI-10000145,Zipper Ring Binder Pockets,312.0,159.0,Office Supplies,Binders
OFF-BI-10000174,"Wilson Jones Clip & Carry Folder Binder Tool for Ring Binders, Clear",580.0,302.0,Office Supplies,Binders
OFF-BI-10000201,"Avery Triangle Shaped Sheet Lifters, Black, 2/Pack",246.0,123.0,Office Supplies,Binders
OFF-BI-10000216,"Mead 1st Gear 2"" Zipper Binder, Asst. Colors",1297.0,648.0,Office Supplies,Binders
OFF-BI-10000279,"Acco Recycled 2"" Capacity Laser Printer Hanging Data Binders",1445.0,766.0,Office Supplies,Binders
OFF-BI-10000285,XtraLife ClearVue Slant-D Ring Binders by Cardinal,784.0,392.0,Office Supplies,Binders
OFF-BI-10000301,GBC Instant Report Kit,647.0,324.0,Office Supplies,Binders
OFF-BI-10000309,"GBC Twin Loop Wire Binding Elements, 9/16"" Spine, Black",1522.0,776.0,Office Supplies,Binders
OFF-BI-10000315,Poly Designer Cover & Back,1898.0,986.0,Office Supplies,Binders
OFF-BI-10000320,GBC Plastic Binding Combs,738.0,376.0,Office Supplies,Binders
OFF-BI-10000343,"Pressboard Covers with Storage Hooks, 9 1/2"" x 11"", Light Blue",491.0,260.0,Office Supplies,Binders
OFF-BI-10000404,Avery Printable Repositionable Plastic Tabs,860.0,455.0,Office Supplies,Binders
OFF-BI-10000474,Avery Recycled Flexi-View Covers for Binding Systems,1603.0,834.0,Office Supplies,Binders
OFF-BI-10000494,Acco Economy Flexible Poly Round Ring Binder,522.0,287.0,Office Supplies,Binders
OFF-BI-10000545,GBC Ibimaster 500 Manual ProClick Binding System,76098.0,38049.0,Office Supplies,Binders
OFF-BI-10000546,Avery Durable Binders,288.0,147.0,Office Supplies,Binders
OFF-BI-10000591,Avery Binder Labels,389.0,202.0,Office Supplies,Binders
OFF-BI-10000605,"Acco Pressboard Covers with Storage Hooks, 9 1/2"" x 11"", Executive Red",381.0,202.0,Office Supplies,Binders
OFF-BI-10000632,Satellite Sectional Post Binders,4341.0,2344.0,Office Supplies,Binders
OFF-BI-10000666,Surelock Post Binders,3056.0,1528.0,Office Supplies,Binders
OFF-BI-10000756,Storex DuraTech Recycled Plastic Frosted Binders,424.0,212.0,Office Supplies,Binders
OFF-BI-10000773,Insertable Tab Post Binder Dividers,802.0,425.0,Office Supplies,Binders
OFF-BI-10000778,GBC VeloBinder Electric Binding Machine,12098.0,6049.0,Office Supplies,Binders
OFF-BI-10000822,"Acco PRESSTEX Data Binder with Storage Hooks, Light Blue, 9 1/2"" X 11""",538.0,280.0,Office Supplies,Binders
OFF-BI-10000829,Avery Non-Stick Binders,449.0,242.0,Office Supplies,Binders
OFF-BI-10000831,Storex Flexible Poly Binders with Double Pockets,264.0,143.0,Office Supplies,Binders
OFF-BI-10000848,Angle-D Ring Binders,547.0,295.0,Office Supplies,Binders
OFF-BI-10000948,"GBC Laser Imprintable Binding System Covers, Desert Sand",1427.0,756.0,Office Supplies,Binders
OFF-BI-10000962,"Acco Flexible ACCOHIDE Square Ring Data Binder, Dark Blue, 11 1/2"" X 14"" 7/8""",1627.0,830.0,Office Supplies,Binders
OFF-BI-10000977,Ibico Plastic Spiral Binding Combs,3040.0,1642.0,Office Supplies,Binders
OFF-BI-10001031,Pressboard Data Binders by Wilson Jones,534.0,283.0,Office Supplies,Binders
OFF-BI-10001036,Cardinal EasyOpen D-Ring Binders,914.0,457.0,Office Supplies,Binders
OFF-BI-10001071,GBC ProClick Punch Binding System,6398.0,3263.0,Office Supplies,Binders
OFF-BI-10001072,"GBC Clear Cover, 8-1/2 x 11, unpunched, 25 covers per pack",1516.0,819.0,Office Supplies,Binders
OFF-BI-10001078,"Acco PRESSTEX Data Binder with Storage Hooks, Dark Blue, 14 7/8"" X 11""",538.0,274.0,Office Supplies,Binders
OFF-BI-10001097,Avery Hole Reinforcements,623.0,318.0,Office Supplies,Binders
OFF-BI-10001098,Acco D-Ring Binder w/DublLock,2138.0,1090.0,Office Supplies,Binders
OFF-BI-10001107,"GBC White Gloss Covers, Plain Front",1448.0,767.0,Office Supplies,Binders
OFF-BI-10001116,"Wilson Jones 1"" Hanging DublLock Ring Binders",528.0,275.0,Office Supplies,Binders
OFF-BI-10001120,Ibico EPK-21 Electric Binding System,188999.0,96389.0,Office Supplies,Binders
OFF-BI-10001132,"Acco PRESSTEX Data Binder with Storage Hooks, Dark Blue, 9 1/2"" X 11""",538.0,274.0,Office Supplies,Binders
OFF-BI-10001153,Ibico Recycled Grain-Textured Covers,3454.0,1727.0,Office Supplies,Binders
OFF-BI-10001191,Canvas Sectional Post Binders,2546.0,1298.0,Office Supplies,Binders
OFF-BI-10001196,"Avery Flip-Chart Easel Binder, Black",2238.0,1186.0,Office Supplies,Binders
OFF-BI-10001249,Avery Heavy-Duty EZD View Binder with Locking Rings,638.0,345.0,Office Supplies,Binders
OFF-BI-10001267,"Universal Recycled Hanging Pressboard Report Binders, Letter Size",617.0,321.0,Office Supplies,Binders
OFF-BI-10001294,Fellowes Binding Cases,1170.0,644.0,Office Supplies,Binders
OFF-BI-10001308,GBC Standard Plastic Binding Systems' Combs,628.0,345.0,Office Supplies,Binders
OFF-BI-10001359,GBC DocuBind TL300 Electric Binding System,89699.0,47540.0,Office Supplies,Binders
OFF-BI-10001460,Plastic Binding Combs,1515.0,802.0,Office Supplies,Binders
OFF-BI-10001510,Deluxe Heavy-Duty Vinyl Round Ring Binder,2292.0,1261.0,Office Supplies,Binders
OFF-BI-10001524,GBC Premium Transparent Covers with Diagonal Lined Pattern,2098.0,1091.0,Office Supplies,Binders
OFF-BI-10001525,"Acco Pressboard Covers with Storage Hooks, 14 7/8"" x 11"", Executive Red",381.0,210.0,Office Supplies,Binders
OFF-BI-10001543,GBC VeloBinder Manual Binding System,3599.0,1871.0,Office Supplies,Binders
OFF-BI-10001553,SpineVue Locking Slant-D Ring Binders by Cardinal,914.0,475.0,Office Supplies,Binders
OFF-BI-10001575,GBC Linen Binding Covers,3098.0,1611.0,Office Supplies,Binders
OFF-BI-10001597,"Wilson Jones Ledger-Size, Piano-Hinge Binder, 2"", Blue",4098.0,2131.0,Office Supplies,Binders
OFF-BI-10001617,GBC Wire Binding Combs,1034.0,548.0,Office Supplies,Binders
OFF-BI-10001628,"Acco Data Flex Cable Posts For Top & Bottom Load Binders, 6"" Capacity",1043.0,574.0,Office Supplies,Binders
OFF-BI-10001634,Wilson Jones Active Use Binders,728.0,371.0,Office Supplies,Binders
OFF-BI-10001636,Ibico Plastic and Wire Spiral Binding Combs,843.0,455.0,Office Supplies,Binders
OFF-BI-10001658,GBC Standard Therm-A-Bind Covers,2492.0,1346.0,Office Supplies,Binders
OFF-BI-10001670,Vinyl Sectional Post Binders,3770.0,1885.0,Office Supplies,Binders
OFF-BI-10001679,GBC Instant Index System for Binding Systems,888.0,444.0,Office Supplies,Binders
OFF-BI-10001718,GBC DocuBind P50 Personal Binding Machine,6398.0,3390.0,Office Supplies,Binders
OFF-BI-10001721,Trimflex Flexible Post Binders,2138.0,1112.0,Office Supplies,Binders
OFF-BI-10001757,Pressboard Hanging Data Binders for Unburst Sheets,492.0,256.0,Office Supplies,Binders
OFF-BI-10001758,Wilson Jones 14 Line Acrylic Coated Pressboard Data Binders,534.0,283.0,Office Supplies,Binders
OFF-BI-10001759,"Acco Pressboard Covers with Storage Hooks, 14 7/8"" x 11"", Dark Blue",381.0,194.0,Office Supplies,Binders
OFF-BI-10001765,Wilson Jones Heavy-Duty Casebound Ring Binders with Metal Hinges,3464.0,1801.0,Office Supplies,Binders
OFF-BI-10001787,Wilson Jones Four-Pocket Poly Binders,654.0,334.0,Office Supplies,Binders
OFF-BI-10001890,Avery Poly Binder Pockets,358.0,186.0,Office Supplies,Binders
OFF-BI-10001900,"DXL Angle-View Binders with Locking Rings, Black",599.0,317.0,Office Supplies,Binders
OFF-BI-10001922,Storex Dura Pro Binders,594.0,315.0,Office Supplies,Binders
OFF-BI-10001982,Wilson Jones Custom Binder Spines & Labels,544.0,277.0,Office Supplies,Binders
OFF-BI-10001989,Premium Transparent Presentation Covers by GBC,2098.0,1091.0,Office Supplies,Binders
OFF-BI-10002003,Ibico Presentation Index for Binding Systems,398.0,211.0,Office Supplies,Binders
OFF-BI-10002012,Wilson Jones Easy Flow II Sheet Lifters,180.0,94.0,Office Supplies,Binders
OFF-BI-10005010,Ibico Recycled Linen-Style Covers,3906.0,2030.0,Office Supplies,Binders
OFF-BI-10002026,Avery Arch Ring Binders,5810.0,3079.0,Office Supplies,Binders
OFF-BI-10002049,UniKeep View Case Binders,488.0,264.0,Office Supplies,Binders
OFF-BI-10002071,Fellowes Black Plastic Comb Bindings,581.0,314.0,Office Supplies,Binders
OFF-BI-10002072,Cardinal Slant-D Ring Binders,869.0,434.0,Office Supplies,Binders
OFF-BI-10002082,GBC Twin Loop Wire Binding Elements,3328.0,1664.0,Office Supplies,Binders
OFF-BI-10002103,"Cardinal Slant-D Ring Binder, Heavy Gauge Vinyl",869.0,469.0,Office Supplies,Binders
OFF-BI-10002133,"Wilson Jones Elliptical Ring 3 1/2"" Capacity Binders, 800 sheets",4280.0,2183.0,Office Supplies,Binders
OFF-BI-10002160,Acco Hanging Data Binders,381.0,198.0,Office Supplies,Binders
OFF-BI-10002194,Cardinal Hold-It CD Pocket,798.0,423.0,Office Supplies,Binders
OFF-BI-10002215,"Wilson Jones Hanging View Binder, White, 1""",710.0,383.0,Office Supplies,Binders
OFF-BI-10002225,"Square Ring Data Binders, Rigid 75 Pt. Covers, 11"" x 14-7/8""",2064.0,1073.0,Office Supplies,Binders
OFF-BI-10002309,Avery Heavy-Duty EZD  Binder With Locking Rings,558.0,290.0,Office Supplies,Binders
OFF-BI-10002353,GBC VeloBind Cover Sets,1544.0,772.0,Office Supplies,Binders
OFF-BI-10002393,Binder Posts,574.0,310.0,Office Supplies,Binders
OFF-BI-10002412,Wilson Jones “Snap” Scratch Pad Binder Tool for Ring Binders,580.0,319.0,Office Supplies,Binders
OFF-BI-10002414,GBC ProClick Spines for 32-Hole Punch,1253.0,664.0,Office Supplies,Binders
OFF-BI-10002429,"Premier Elliptical Ring Binder, Black",3044.0,1583.0,Office Supplies,Binders
OFF-BI-10002432,Wilson Jones Standard D-Ring Binders,505.0,268.0,Office Supplies,Binders
OFF-BI-10002437,Recycled Premium Regency Composition Covers,1528.0,779.0,Office Supplies,Binders
OFF-BI-10002498,Clear Mylar Reinforcing Strips,1869.0,991.0,Office Supplies,Binders
OFF-BI-10002557,Presstex Flexible Ring Binders,455.0,227.0,Office Supplies,Binders
OFF-BI-10002571,"Avery Framed View Binder, EZD Ring (Locking), Navy, 1 1/2""",998.0,529.0,Office Supplies,Binders
OFF-BI-10002609,Avery Hidden Tab Dividers for Binding Systems,298.0,161.0,Office Supplies,Binders
OFF-BI-10002706,Avery Premier Heavy-Duty Binder with Round Locking Rings,1428.0,771.0,Office Supplies,Binders
OFF-BI-10002735,GBC Prestige Therm-A-Bind Covers,3431.0,1818.0,Office Supplies,Binders
OFF-BI-10002764,Recycled Pressboard Report Cover with Reinforced Top Hinge,323.0,165.0,Office Supplies,Binders
OFF-BI-10002794,"Avery Trapezoid Ring Binder, 3"" Capacity, Black, 1040 sheets",4098.0,2090.0,Office Supplies,Binders
OFF-BI-10002799,"SlimView Poly Binder, 3/8""",518.0,280.0,Office Supplies,Binders
OFF-BI-10002813,Avery Reinforcements for Hole-Punch Pages,198.0,109.0,Office Supplies,Binders
OFF-BI-10002824,Recycled Easel Ring Binders,1492.0,821.0,Office Supplies,Binders
OFF-BI-10002827,Avery Durable Poly Binders,553.0,299.0,Office Supplies,Binders
OFF-BI-10002852,Ibico Standard Transparent Covers,1648.0,840.0,Office Supplies,Binders
OFF-BI-10002854,"Performers Binder/Pad Holder, Black",2803.0,1402.0,Office Supplies,Binders
OFF-BI-10002867,GBC Recycled Regency Composition Covers,5978.0,3228.0,Office Supplies,Binders
OFF-BI-10002897,"Black Avery Memo-Size 3-Ring Binder, 5 1/2"" x 8 1/2""",367.0,187.0,Office Supplies,Binders
OFF-BI-10002931,"Avery Trapezoid Extra Heavy Duty 4"" Binders",4194.0,2097.0,Office Supplies,Binders
OFF-BI-10002949,Prestige Round Ring Binders,608.0,322.0,Office Supplies,Binders
OFF-BI-10002954,Newell 3-Hole Punched Plastic Slotted Magazine Holders for Binders,457.0,238.0,Office Supplies,Binders
OFF-BI-10002976,ACCOHIDE Binder by Acco,413.0,219.0,Office Supplies,Binders
OFF-BI-10002982,Avery Self-Adhesive Photo Pockets for Polaroid Photos,681.0,354.0,Office Supplies,Binders
OFF-BI-10003007,"Premium Transparent Presentation Covers, No Pattern/Clear, 8 1/2"" x 11""",3878.0,2094.0,Office Supplies,Binders
OFF-BI-10003091,GBC DocuBind TL200 Manual Binding Machine,22398.0,11871.0,Office Supplies,Binders
OFF-BI-10003094,Self-Adhesive Ring Binder Labels,352.0,187.0,Office Supplies,Binders
OFF-BI-10003166,GBC Plasticlear Binding Covers,1148.0,597.0,Office Supplies,Binders
OFF-BI-10003196,Accohide Poly Flexible Ring Binders,374.0,187.0,Office Supplies,Binders
OFF-BI-10003274,"Avery Durable Slant Ring Binders, No Labels",398.0,211.0,Office Supplies,Binders
OFF-BI-10003291,Wilson Jones Leather-Like Binders with DublLock Round Rings,873.0,463.0,Office Supplies,Binders
OFF-BI-10003305,Avery Hanging File Binders,598.0,323.0,Office Supplies,Binders
OFF-BI-10003314,Tuff Stuff Recycled Round Ring Binders,482.0,246.0,Office Supplies,Binders
OFF-BI-10003350,Acco Expandable Hanging Binders,638.0,345.0,Office Supplies,Binders
OFF-BI-10003355,Cardinal Holdit Business Card Pockets,498.0,259.0,Office Supplies,Binders
OFF-BI-10003364,Binding Machine Supplies,2917.0,1517.0,Office Supplies,Binders
OFF-BI-10003429,"Cardinal HOLDit! Binder Insert Strips,Extra Strips",633.0,323.0,Office Supplies,Binders
OFF-BI-10003460,Acco 3-Hole Punch,438.0,227.0,Office Supplies,Binders
OFF-BI-10003476,Avery Metallic Poly Binders,573.0,298.0,Office Supplies,Binders
OFF-BI-10003527,Fellowes PB500 Electric Punch Plastic Comb Binding Machine with Manual Bind,127099.0,63550.0,Office Supplies,Binders
OFF-BI-10003529,Avery Round Ring Poly Binders,284.0,145.0,Office Supplies,Binders
OFF-BI-10003638,GBC Durable Plastic Covers,1935.0,1045.0,Office Supplies,Binders
OFF-BI-10003650,GBC DocuBind 300 Electric Binding Machine,52598.0,27351.0,Office Supplies,Binders
OFF-BI-10003655,Durable Pressboard Binders,380.0,200.0,Office Supplies,Binders
OFF-BI-10003656,Fellowes PB200 Plastic Comb Binding Machine,16999.0,9179.0,Office Supplies,Binders
OFF-BI-10003669,3M Organizer Strips,540.0,281.0,Office Supplies,Binders
OFF-BI-10003676,"GBC Standard Recycled Report Covers, Clear Plastic Sheets",1078.0,561.0,Office Supplies,Binders
OFF-BI-10003684,Wilson Jones Legal Size Ring Binders,2199.0,1100.0,Office Supplies,Binders
OFF-BI-10003694,"Avery 3 1/2"" Diskette Storage Pages, 10/Pack",1044.0,564.0,Office Supplies,Binders
OFF-BI-10003707,Aluminum Screw Posts,1526.0,763.0,Office Supplies,Binders
OFF-BI-10003708,"Acco Four Pocket Poly Ring Binder with Label Holder, Smoke, 1""",745.0,409.0,Office Supplies,Binders
OFF-BI-10003712,"Acco Pressboard Covers with Storage Hooks, 14 7/8"" x 11"", Light Blue",491.0,250.0,Office Supplies,Binders
OFF-BI-10003718,GBC Therma-A-Bind 250T Electric Binding System,12299.0,6395.0,Office Supplies,Binders
OFF-BI-10003719,Large Capacity Hanging Post Binders,2495.0,1347.0,Office Supplies,Binders
OFF-BI-10003727,Avery Durable Slant Ring Binders With Label Holder,418.0,217.0,Office Supplies,Binders
OFF-BI-10003784,Computer Printout Index Tabs,168.0,87.0,Office Supplies,Binders
OFF-BI-10003876,"Green Canvas Binder for 8-1/2"" x 14"" Sheets",4280.0,2140.0,Office Supplies,Binders
OFF-BI-10003910,DXL Angle-View Binders with Locking Rings by Samsill,771.0,424.0,Office Supplies,Binders
OFF-BI-10003925,Fellowes PB300 Plastic Comb Binding Machine,38799.0,20563.0,Office Supplies,Binders
OFF-BI-10003963,Cardinal Holdit Data Disk Pockets,728.0,386.0,Office Supplies,Binders
OFF-BI-10003981,"Avery Durable Plastic 1"" Binders",454.0,231.0,Office Supplies,Binders
OFF-BI-10003982,Wilson Jones Century Plastic Molded Ring Binders,2077.0,1101.0,Office Supplies,Binders
OFF-BI-10003984,Lock-Up Easel 'Spel-Binder',2853.0,1512.0,Office Supplies,Binders
OFF-BI-10004001,GBC Recycled VeloBinder Covers,1704.0,919.0,Office Supplies,Binders
OFF-BI-10004002,Wilson Jones International Size A4 Ring Binders,1730.0,900.0,Office Supplies,Binders
OFF-BI-10004022,Acco Suede Grain Vinyl Round Ring Binder,278.0,150.0,Office Supplies,Binders
OFF-BI-10004040,Wilson Jones Impact Binders,518.0,264.0,Office Supplies,Binders
OFF-BI-10004094,GBC Standard Plastic Binding Systems Combs,885.0,451.0,Office Supplies,Binders
OFF-BI-10004099,GBC VeloBinder Strips,768.0,384.0,Office Supplies,Binders
OFF-BI-10004139,Fellowes Presentation Covers for Comb Binding Machines,1455.0,800.0,Office Supplies,Binders
OFF-BI-10004140,Avery Non-Stick Binders,449.0,247.0,Office Supplies,Binders
OFF-BI-10004141,Insertable Tab Indexes For Data Binders,318.0,172.0,Office Supplies,Binders
OFF-BI-10004182,Economy Binders,208.0,106.0,Office Supplies,Binders
OFF-BI-10004187,3-ring staple pack,188.0,98.0,Office Supplies,Binders
